{
  "$schema": "https://json-schema.org/draft/2020-12/schema",
  "$id": "https://artifacts.burooj.dev/model-tasting/schemas/recipe.v1.json",
  "title": "Model Tasting Kitchen recipe",
  "type": "object",
  "additionalProperties": false,
  "required": [
    "schemaVersion",
    "id",
    "version",
    "status",
    "title",
    "summary",
    "cuisines",
    "origin",
    "originNote",
    "tags",
    "kind",
    "harness",
    "setup",
    "turns",
    "output",
    "validation"
  ],
  "properties": {
    "schemaVersion": { "const": 1 },
    "id": { "type": "string", "pattern": "^[a-z0-9]+(?:-[a-z0-9]+)*$" },
    "version": { "type": "string", "pattern": "^[0-9]+\\.[0-9]+\\.[0-9]+$" },
    "status": { "enum": ["draft", "ready", "hidden"] },
    "visibility": { "enum": ["public", "private"] },
    "title": { "type": "string", "minLength": 4, "maxLength": 100 },
    "summary": { "type": "string", "minLength": 12, "maxLength": 300 },
    "cuisines": {
      "type": "array",
      "minItems": 1,
      "uniqueItems": true,
      "items": { "type": "string" }
    },
    "origin": { "enum": ["textbook", "mothers", "hybrid"] },
    "originNote": { "type": "string", "minLength": 8, "maxLength": 300 },
    "tags": {
      "type": "array",
      "minItems": 1,
      "maxItems": 6,
      "uniqueItems": true,
      "items": { "type": "string" }
    },
    "kind": { "enum": ["web", "image", "code", "session", "document", "audio"] },
    "harness": {
      "type": "object",
      "additionalProperties": false,
      "required": ["workspace", "web", "capabilities"],
      "properties": {
        "workspace": { "enum": ["read", "write"] },
        "web": { "enum": ["disabled", "enabled", "closed-sources-only"] },
        "capabilities": {
          "type": "array",
          "uniqueItems": true,
          "items": { "enum": ["files", "shell", "tools", "delegation", "image-generation"] }
        }
      }
    },
    "setup": {
      "type": "object",
      "additionalProperties": false,
      "required": ["instructions", "fixtures"],
      "properties": {
        "instructions": { "type": "string", "minLength": 1 },
        "fixtures": {
          "type": "array",
          "items": {
            "type": "object",
            "additionalProperties": false,
            "required": ["id", "path", "mountAs", "public", "mediaType"],
            "properties": {
              "id": { "type": "string", "pattern": "^[a-z0-9]+(?:-[a-z0-9]+)*$" },
              "path": { "$ref": "#/$defs/relativePath" },
              "mountAs": { "$ref": "#/$defs/relativePath" },
              "public": { "type": "boolean" },
              "editable": { "type": "boolean" },
              "mediaType": { "type": "string", "pattern": "^[a-z0-9!#$&^_.+-]+/[a-z0-9!#$&^_.+-]+$" }
            }
          }
        }
      }
    },
    "turns": {
      "type": "array",
      "minItems": 1,
      "items": {
        "type": "object",
        "additionalProperties": false,
        "required": ["id", "role", "content"],
        "properties": {
          "id": { "type": "string", "pattern": "^[a-z0-9]+(?:-[a-z0-9]+)*$" },
          "role": { "enum": ["prompt", "follow-up", "correction", "mode-transition"] },
          "content": { "type": "string", "minLength": 1 }
        }
      }
    },
    "output": {
      "type": "object",
      "additionalProperties": false,
      "required": ["kind", "entry", "include", "limits"],
      "properties": {
        "kind": { "enum": ["web", "image", "code", "session", "document", "audio"] },
        "entry": { "$ref": "#/$defs/relativePath" },
        "include": { "type": "array", "minItems": 1, "uniqueItems": true, "items": { "$ref": "#/$defs/relativeGlob" } },
        "limits": {
          "type": "object",
          "additionalProperties": false,
          "required": ["maxFiles", "maxBytes"],
          "properties": {
            "maxFiles": { "type": "integer", "minimum": 1, "maximum": 2000 },
            "maxBytes": { "type": "integer", "minimum": 1024, "maximum": 104857600 }
          }
        }
      }
    },
    "validation": {
      "type": "object",
      "additionalProperties": false,
      "required": ["mode", "checks"],
      "properties": {
        "mode": { "enum": ["completeness", "files", "interaction", "tests", "trace", "manual"] },
        "checks": {
          "type": "array",
          "minItems": 1,
          "items": {
            "type": "object",
            "additionalProperties": false,
            "required": ["id", "type", "required", "description"],
            "properties": {
              "id": { "type": "string", "pattern": "^[a-z0-9]+(?:-[a-z0-9]+)*$" },
              "type": { "enum": ["file-exists", "command", "json-schema", "trace-assertion", "manual"] },
              "required": { "type": "boolean" },
              "description": { "type": "string", "minLength": 4 },
              "target": { "$ref": "#/$defs/relativePath" },
              "schema": { "$ref": "#/$defs/relativePath" },
              "argv": { "type": "array", "minItems": 1, "items": { "type": "string", "minLength": 1 } }
            },
            "allOf": [
              {
                "if": { "properties": { "type": { "const": "file-exists" } }, "required": ["type"] },
                "then": { "required": ["target"] }
              },
              {
                "if": { "properties": { "type": { "const": "command" } }, "required": ["type"] },
                "then": { "required": ["argv"] }
              },
              {
                "if": { "properties": { "type": { "const": "json-schema" } }, "required": ["type"] },
                "then": { "required": ["target", "schema"] }
              },
              {
                "if": { "properties": { "type": { "enum": ["trace-assertion", "manual"] } }, "required": ["type"] },
                "then": { "properties": { "required": { "const": false } } }
              }
            ]
          }
        }
      }
    },
    "presentation": {
      "type": "object",
      "additionalProperties": false,
      "required": ["profile", "semanticRuntime"],
      "properties": {
        "profile": { "type": "string", "pattern": "^[a-z0-9]+(?:-[a-z0-9]+)*$" },
        "semanticRuntime": {
          "oneOf": [
            { "type": "null" },
            {
              "type": "object",
              "additionalProperties": false,
              "required": ["id", "version"],
              "properties": {
                "id": { "type": "string", "pattern": "^[a-z0-9]+(?:-[a-z0-9]+)*$" },
                "version": { "type": "string", "minLength": 1 }
              }
            }
          ]
        }
      }
    },
    "skills": {
      "type": "object",
      "additionalProperties": false,
      "required": ["mountAs", "optional", "layers"],
      "properties": {
        "mountAs": { "$ref": "#/$defs/relativePath" },
        "optional": { "type": "boolean" },
        "layers": { "type": "array", "minItems": 1, "uniqueItems": true, "items": { "type": "string", "pattern": "^[a-z0-9]+(?:-[a-z0-9]+)*$" } }
      }
    },
    "variation": { "type": "string", "maxLength": 500 },
    "supersedes": { "type": "string", "pattern": "^[a-z0-9]+(?:-[a-z0-9]+)*$" }
  },
  "$defs": {
    "relativePath": {
      "type": "string",
      "minLength": 1,
      "pattern": "^(?!/)(?!.*\\\\)(?!.*(?:^|/)\\.\\.(?:/|$))[^\\u0000]+$"
    },
    "relativeGlob": {
      "type": "string",
      "minLength": 1,
      "pattern": "^(?!/)(?!.*\\\\)(?!.*(?:^|/)\\.\\.(?:/|$))[^\\u0000]+$"
    }
  }
}
